{
  "dataset": "3DBAG",
  "id": "ops_3dbag_enriched",
  "license": "Use the upstream 3DBAG license terms until the corpus release metadata is published.",
  "notes": "Real 3DBAG geometry enriched with synthetic non-geometric data so object-graph traversal, attribute lookup, and roundtrip stability can be measured on a mixed payload. It reuses the published raw 3DBAG CityJSON slice.",
  "outputs": [
    {
      "derivation": "acquired",
      "byte_size": null,
      "checksum": null,
      "path": "artifacts/acquired/3dbag/v20250903/10-758-50.city.json",
      "published": true,
      "producer": "upstream",
      "representation": "cityjson",
      "validation_role": "canonical"
    }
  ],
  "owner": "cjindex",
  "preprocessing": [
    "Run the shared 3DBAG acquisition script in cityjson-corpus.",
    "Reuse the published raw CityJSON file for object-model benchmarking.",
    "Apply the synthetic enrichment step after preparing the base 3DBAG slice."
  ],
  "reference": "Use `just acquire-3dbag` in cityjson-corpus to materialize the raw slice.",
  "selector": "Pinned 3DBAG release metadata is captured by the shared acquisition script.",
  "status": "published",
  "upstream_url": "https://data.3dbag.nl/v20250903/",
  "upstream_version": "2025.09.03",
  "version": 2
}
