{
  "dataset": "3DBAG",
  "id": "io_3dbag_cityjson_cluster_4x",
  "license": "Use the upstream 3DBAG license terms until the corpus release metadata is published.",
  "notes": "Merged real-geometry 3DBAG workload built from four contiguous tiles in the published v20250903 release. It extends the monolithic CityJSON workload to a larger, still realistic memory and cache stress case.",
  "outputs": [
    {
      "derivation": "merged",
      "byte_size": null,
      "checksum": null,
      "derived_from": [
        "artifacts/acquired/3dbag/v20250903/10-758-50.city.json",
        "artifacts/acquired/3dbag/v20250903/10-756-48.city.json",
        "artifacts/acquired/3dbag/v20250903/10-756-50.city.json",
        "artifacts/acquired/3dbag/v20250903/10-758-48.city.json"
      ],
      "path": "artifacts/acquired/3dbag/v20250903/cluster_4x.city.json",
      "published": true,
      "producer": "cjio",
      "representation": "cityjson",
      "validation_role": "benchmark-only"
    }
  ],
  "owner": "cjindex",
  "preprocessing": [
    "Run the shared 3DBAG acquisition script in cityjson-corpus.",
    "Download the pinned 2x2 tile cluster around the base tile.",
    "Merge the four real CityJSON tiles with cjio and publish the merged workload artifact."
  ],
  "reference": "Use `just acquire-3dbag` in cityjson-corpus to materialize the raw tiles and merged stress case.",
  "selector": "Pinned v20250903 tiles: 10-758-50, 10-756-48, 10-756-50, and 10-758-48.",
  "status": "published",
  "upstream_url": "https://data.3dbag.nl/v20250903/",
  "upstream_version": "2025.09.03",
  "version": 2
}
