{
  "dataset": "Basisvoorziening 3D",
  "id": "io_basisvoorziening_3d_cityjson",
  "license": "Use the upstream PDOK / Kadaster 3D Basisvoorziening terms (CC BY 4.0).",
  "notes": "Monolithic real-geometry Basisvoorziening 3D case stored as a whole CityJSON file. It complements the 3DBAG baseline with a larger terrain-inclusive Dutch tile acquired through the PDOK OGC API for the published 2022 collection.",
  "outputs": [
    {
      "derivation": "acquired",
      "byte_size": null,
      "checksum": null,
      "path": "artifacts/acquired/basisvoorziening-3d/2022/3d_volledig_84000_450000.city.json",
      "published": true,
      "producer": "upstream",
      "representation": "cityjson",
      "validation_role": "canonical"
    }
  ],
  "owner": "cjindex",
  "preprocessing": [
    "Run the shared Basisvoorziening 3D acquisition script in cityjson-corpus.",
    "Resolve the pinned 2022 volledig tile through the PDOK OGC API.",
    "Download the archive referenced by the resolved OGC feature.",
    "Extract the published CityJSON tile from the zip archive."
  ],
  "reference": "Use `just acquire-basisvoorziening-3d` in cityjson-corpus to materialize the raw tile via the PDOK OGC API.",
  "selector": "Pinned 2022 volledig tile: 84000_450000.",
  "status": "published",
  "upstream_url": "https://api.pdok.nl/kadaster/3d-basisvoorziening/ogc/v1/collections/basisbestand_gebouwen_terreinen/items?f=json&limit=1000",
  "upstream_version": "2022",
  "version": 2
}
